<?xml version="1.0" encoding="UTF-8" ?>

<analytic-stream xmlns:xsi="http://www.w3.org/2001/XMLSchema-instance"
                 xsi:noNamespaceSchemaLocation="https://www.cs.odu.edu/~yasith/dfs/v1/dfs.xsd">
  <info>
    <checksum>010203040506070809000A0B0C0D0E0F</checksum>
    <analytic>
      <name>de-noised heart rate</name>
    </analytic>
  </info>
  <fields>
    <field>
      <id>t</id>
      <name>timestamp</name>
      <description>Timestamp</description>
      <dtype>float</dtype>
    </field>
    <field>
      <id>hr</id>
      <name>heart rate</name>
      <description>Heart Rate</description>
      <dtype>float</dtype>
    </field>
    <field>
      <id>hr-d</id>
      <name>de-noised heart rate</name>
      <description>De-Noised Heart Rate</description>
      <dtype>float</dtype>
    </field>
  </fields>
  <inputs>
    <meta-stream>
      <device>
        <model>E4</model>
        <manufacturer>Empatica</manufacturer>
        <category>Wristband</category>
      </device>
      <streams>
        <stream>
          <name>timestamp</name>
          <description>Timestamp</description>
          <unit>ms</unit>
          <frequency>0</frequency>
          <channels>
            <channel>t</channel>
          </channels>
        </stream>
        <stream>
          <name>heart rate</name>
          <description>Heart rate (unit - beats per minute)</description>
          <unit>bpm</unit>
          <frequency>0</frequency>
          <channels>
            <channel>hr</channel>
          </channels>
        </stream>
      </streams>
    </meta-stream>
  </inputs>
  <outputs>
    <key>hr-d</key>
  </outputs>
</analytic-stream>